{
  "evidence_id": "EVB-DEMO-001",
  "control_id": "SDC-002",
  "change_id": "PR-EXAMPLE-001",
  "repository": "example/secure-delivery-demo",
  "commit_sha": "0123456789abcdef0123456789abcdef01234567",
  "actor": "example-contributor",
  "actor_type": "human",
  "workflow": "ci-validation",
  "run_id": "example-run-001",
  "artifact_digest": null,
  "environment": null,
  "producer": "example-ci",
  "timestamp": "2026-08-11T00:00:00Z",
  "verifier": "independent-ci-validator",
  "evidence_type": "test-report",
  "evidence_uri": "https://example.invalid/evidence/EVB-DEMO-001",
  "content_digest": "sha256:0123456789abcdef0123456789abcdef0123456789abcdef0123456789abcdef",
  "retention_class": "audit",
  "sensitivity": "internal",
  "result": "pass",
  "correlation_id": "example-correlation-001",
  "redaction_applied": false
}
